{
  "entries": [
    {
      "arguments": [
        "/usr/bin/c++",
        "-DBUILDSCOPE_CORE=1",
        "-std=c++20",
        "-I/project/include",
        "-c",
        "/project/src/core.cpp"
      ],
      "command": null,
      "directory": "/project/build",
      "file": "/project/src/core.cpp",
      "output": null
    },
    {
      "arguments": null,
      "command": "/usr/bin/c++ -DBUILDSCOPE_APP=1 -std=c++20 -I/project/include -c /project/src/main.cpp",
      "directory": "/project/build",
      "file": "/project/src/main.cpp",
      "output": "CMakeFiles/buildscope.dir/src/main.cpp.o"
    }
  ],
  "producer": {
    "name": "buildscope",
    "version": "0.1.0"
  },
  "schema_version": "buildscope.snapshot/v1",
  "source": {
    "entry_count": 2,
    "path": "fixtures/compile_commands.json"
  }
}
